{
  "schemaVersion": 1,
  "kind": "quantum-open-problem",
  "id": "ruskai-2007-random-subunitary-coherent-information",
  "title": "Coherent information of random sub-unitary channels",
  "status": "open",
  "dates": {
    "proposed": "2007",
    "latestEvidence": "2007",
    "verified": "2026-08-12",
    "catalogAsOf": "2026-08-31"
  },
  "taxonomy": {
    "field": {
      "id": "quantum-information",
      "label": "Quantum information"
    },
    "topic": {
      "id": "quantum-channels",
      "label": "Quantum channels"
    }
  },
  "collection": {
    "id": "ruskai-2007",
    "label": "Ruskai",
    "title": "Open problems in quantum information theory",
    "url": null
  },
  "question": {
    "type": "Channel analysis",
    "summary": "No complete degradability, coherent-information or capacity analysis is known for the intended normalized cyclic sub-unitary family.",
    "importance": "The cyclic low-rank Kraus structure offers a controlled testbed for degradability and superadditive coherent information. A solution would give exact capacities for a nontrivial noisy-channel family.",
    "unresolved": "Classify degradability and determine coherent-information additivity and quantum capacity for the intended random sub-unitary channel class."
  },
  "formulation": {
    "notation": "| Symbol | Meaning |\n|---|---|\n| $M_d$ | Algebra of complex $d\\times d$ matrices |\n| $\\rho$ | A density matrix (positive semi-definite, trace $1$) |\n| $\\Phi$ | A completely positive trace-preserving (CPT) linear map (quantum channel) |\n| $\\Phi^C$ | A complementary channel of $\\Phi$ |\n| $\\{A_k\\}$ | Kraus operators of a channel, $\\Phi(\\rho)=\\sum_k A_k\\rho A_k^{\\dagger}$ |\n| $X$ | Cyclic shift operator on $\\mathbb{C}^d$, $X\\lvert e_j\\rangle=\\lvert e_{j+1}\\rangle$ |\n| $U_k$ | A $(d-1)\\times(d-1)$ unitary appearing in the $k$-th Kraus operator |\n| $S(\\sigma)$ | von Neumann entropy, $S(\\sigma)=-\\operatorname{Tr}(\\sigma\\log\\sigma)$ |\n| $I_c(\\rho,\\Phi)$ | Coherent information of $\\rho$ through $\\Phi$, $I_c(\\rho,\\Phi)=S(\\Phi(\\rho))-S(\\Phi^C(\\rho))$ |\n| $Q^{(1)}(\\Phi)$ | Single-letter coherent information capacity, $Q^{(1)}(\\Phi)=\\sup_\\rho I_c(\\rho,\\Phi)$ |\n| $Q(\\Phi)$ | Quantum capacity, $Q(\\Phi)=\\lim_{n\\to\\infty}\\frac{1}{n}Q^{(1)}(\\Phi^{\\otimes n})$ |\n| Degradable channel | $\\Phi$ such that there exists a CPT map $\\mathcal D$ with $\\Phi^C=\\mathcal D\\circ\\Phi$ |",
    "statement": "Interpreting equation (22) as the intended normalized cyclic random-sub-unitary CPT construction, let $\\Phi:M_d\\to M_d$ belong to that family. The source prints\n$$A_k=\\tfrac{1}{d-1}X^k\\begin{pmatrix}U_k & 0\\\\ 0 & 0\\end{pmatrix},\\qquad k=0,1,\\dots,d-1,$$\nwith $U_k$ arbitrary $(d-1)\\times(d-1)$ unitaries, but this formula is not CPT as written.\n\n**Problem 10.** Determine the properties of the coherent information $I_c(\\rho,\\Phi)$ of random sub-unitary channels $\\Phi$ of this form. In particular:\n\n1. For which choices of $\\{U_k\\}$, $d$ is $\\Phi$ degradable?\n2. When is the coherent information of $\\Phi$ additive in the sense\n$$\\sup_\\rho I_c(\\rho,\\Phi\\otimes\\Phi)=2\\sup_\\rho I_c(\\rho,\\Phi),$$\ni.e. $Q^{(1)}(\\Phi^{\\otimes 2})=2Q^{(1)}(\\Phi)$, and more generally for all tensor powers?\n3. What are the resulting consequences for the quantum capacity $Q(\\Phi)$?"
  },
  "source": {
    "title": "Open problems in quantum information theory",
    "authors": [
      "Mary Beth Ruskai"
    ],
    "venue": "arXiv:0708.1902 [quant-ph] (2007); based on BIRS workshop on Operator Structures in QIT, Banff, 11-16 Feb 2007",
    "locator": "p. 10 (Problem 10)",
    "url": "https://doi.org/10.48550/arXiv.0708.1902",
    "relationship": "The source states the cataloged problem."
  },
  "evidence": {
    "progress": [
      {
        "date": "2007",
        "title": "Bounded-Schmidt-rank tools address only the surrounding structure",
        "detail": "Sub-unitary and generic-channel methods provide context, but no full theorem for this cyclic family.",
        "maturity": "Peer reviewed",
        "strength": "Related methods",
        "url": "https://arxiv.org/abs/0706.0705",
        "label": "Subspace methods"
      }
    ],
    "cautions": [],
    "interpretation": "The printed Kraus formula is not trace preserving. The research question is interpreted for the intended normalized cyclic family with varying input supports.",
    "provenance": null
  },
  "relations": {
    "relatedProblems": []
  },
  "discovery": {
    "keywords": [
      "sub-unitary channels",
      "coherent information",
      "degradability",
      "quantum capacity"
    ]
  },
  "research": {
    "briefMarkdown": "https://naixu-guo.github.io/quantum-information-open-problems/packets/ruskai-2007-random-subunitary-coherent-information.md",
    "submitResult": "https://github.com/Naixu-Guo/quantum-information-open-problems/issues/new?template=research-update.yml&title=%5BResearch+update%5D+Coherent+information+of+random+sub-unitary+channels",
    "contributionSchema": "https://naixu-guo.github.io/quantum-information-open-problems/api/v1/contribution.schema.json"
  },
  "links": {
    "self": "https://naixu-guo.github.io/quantum-information-open-problems/api/v1/problems/ruskai-2007-random-subunitary-coherent-information.json",
    "human": "https://naixu-guo.github.io/quantum-information-open-problems/problems/ruskai-2007-random-subunitary-coherent-information/",
    "explorer": "https://naixu-guo.github.io/quantum-information-open-problems/#ruskai-2007-random-subunitary-coherent-information",
    "markdown": "https://naixu-guo.github.io/quantum-information-open-problems/packets/ruskai-2007-random-subunitary-coherent-information.md",
    "schema": "https://naixu-guo.github.io/quantum-information-open-problems/api/v1/problem.schema.json",
    "api": "https://naixu-guo.github.io/quantum-information-open-problems/api/v1/problems/ruskai-2007-random-subunitary-coherent-information.json",
    "sourceRecord": "https://github.com/Naixu-Guo/quantum-information-open-problems/blob/main/open_prob/ruskai-2007-random-subunitary-coherent-information/problem.md"
  },
  "revision": {
    "algorithm": "sha256",
    "projection": "content-v1",
    "recordDigest": "d5b77f20bc8a851393f9a0f93e18e2ad8394154a6948c65cd83823649afceefa",
    "statementDigest": "73253408e993cc6236ee823b286bc1483b4579d5a18881f37957faa4e3e51727"
  }
}
