{
  "schemaVersion": 1,
  "kind": "quantum-open-problem",
  "id": "krueger-2005-catalytic-majorization",
  "title": "Catalytic majorization",
  "status": "partial",
  "dates": {
    "proposed": "2000-12-18",
    "latestEvidence": "2026-03-19",
    "verified": "2026-08-12",
    "catalogAsOf": "2026-08-31"
  },
  "taxonomy": {
    "field": {
      "id": "quantum-information",
      "label": "Quantum information"
    },
    "topic": {
      "id": "entanglement-theory",
      "label": "Entanglement theory"
    }
  },
  "collection": {
    "id": "krueger-2005",
    "label": "Krueger–Werner",
    "title": "Some open problems in quantum information theory",
    "url": null
  },
  "question": {
    "type": "Characterization",
    "summary": "Trumping has exact necessary-and-sufficient characterizations by infinite families of inequalities, but no finite efficient test comparable to Nielsen's partial-sum criterion is known.",
    "importance": "Catalysts enlarge the set of pure-state transformations possible under LOCC without being consumed. A finite criterion would turn that resource conversion rule into a practical decision procedure.",
    "unresolved": "Find a finite, tractable necessary-and-sufficient criterion for catalytic majorization, or prove that no such reduction exists."
  },
  "formulation": {
    "notation": "| Symbol | Meaning |\n|---|---|\n| $p = (p_1, \\ldots, p_n)$ | A probability vector |\n| $q = (q_1, \\ldots, q_n)$ | A probability vector |\n| $r$ | An auxiliary probability vector (the \"catalyst\") |\n| $p \\otimes r$ | Tensor product of probability vectors (coordinate-wise products) |\n| $A, B$ | Pure bipartite quantum states |\n| $C$ | An auxiliary entangled \"catalyst\" state |\n| LOCC | Local operations and classical communication |\n| $D$ | A doubly stochastic matrix (nonnegative; row and column sums equal $1$) |\n| $f$ | A real-valued (convex) function on $\\mathbf{R}$ |\n| Majorization $p \\prec q$ | $\\sum_{i > k} p_i \\le \\sum_{i > k} q_i$ for all $k$ when $p, q$ are in decreasing order (i.e., $q$ is \"more mixed\" than $p$ in the source's terminology, i.e., $p$ has its mass more concentrated) |\n| Catalytic majorization | Existence of an auxiliary $r$ with $p \\otimes r$ majorized by $q \\otimes r$ in the same sense |",
    "statement": "Define the relation *catalytic majorization* on probability vectors as follows: $p$ catalytically majorizes $q$ if there exists a probability vector $r$ such that $p \\otimes r$ is more mixed than $q \\otimes r$ in the sense of (ordinary) majorization, i.e., for $p, q, r$ rearranged in decreasing order,\n\n$$\\sum_{i > k} (p \\otimes r)_i \\;\\le\\; \\sum_{i > k} (q \\otimes r)_i \\qquad \\text{for all } k \\in \\mathbf{Z}_{\\ge 0}.$$\n\nEquivalently (Nielsen) on pure bipartite quantum states: $A$ can be converted into $B$ with a catalyst by LOCC iff the Schmidt-coefficient vectors $p$ of $A$ and $q$ of $B$ satisfy this catalytic majorization relation.\n\nGive an efficient, explicit, mathematically transparent criterion — analogous to Nielsen's criterion for plain LOCC convertibility — that decides which pure bipartite states can be converted into which by LOCC with a catalyst; equivalently, decide the relation of catalytic majorization on classical probability vectors.\n\nA promising line indicated in the source: find a class $\\mathcal{F}$ of convex functions $f : \\mathbf{R} \\to \\mathbf{R}$ such that\n\n$$p \\;\\mapsto\\; \\sum_i f(p_i)$$\n\nis monotone under catalytic majorization for every $f \\in \\mathcal{F}$, and use the monotonicity of all such functionals to characterise the relation. Multiplicative candidates such as $f(t) = t^x$ ($x>1$) are natural because they yield functionals that factor through tensor products."
  },
  "source": {
    "title": "Some open problems in quantum information theory",
    "authors": [
      "O. Krüger",
      "R. F. Werner"
    ],
    "venue": "arXiv:quant-ph/0504166 (2005); snapshot of the IMaPh open-problems collection, TU Braunschweig — http://www.imaph.tu-bs.de/qi/problems/",
    "locator": "pp. 23-24 (Problem 4)",
    "url": "https://doi.org/10.48550/arXiv.quant-ph/0504166",
    "relationship": "The source states the cataloged problem."
  },
  "evidence": {
    "progress": [
      {
        "date": "2026-03-19",
        "title": "A finite sufficient criterion is available",
        "detail": "The new finite test certifies catalytic transformations but is not necessary, so it does not replace the infinite exact characterization.",
        "maturity": "Peer reviewed",
        "strength": "Sufficient criterion",
        "url": "https://www.nature.com/articles/s42005-026-02583-x",
        "label": "Communications Physics"
      },
      {
        "date": "2007-09-24",
        "title": "Klimesh gives an exact infinite characterization",
        "detail": "A family of strict inequalities is necessary and sufficient for trumping under the theorem's support conditions.",
        "maturity": "Preprint",
        "strength": "Exact characterization",
        "url": "https://arxiv.org/abs/0709.3680",
        "label": "Klimesh theorem"
      },
      {
        "date": "2007-07-03",
        "title": "Turgut derives independent exact conditions",
        "detail": "Power means and entropy give another necessary-and-sufficient infinite criterion for catalytic conversion.",
        "maturity": "Peer reviewed",
        "strength": "Exact characterization",
        "url": "https://arxiv.org/abs/0707.0444",
        "label": "Turgut theorem"
      }
    ],
    "cautions": [],
    "interpretation": null,
    "provenance": null
  },
  "relations": {
    "relatedProblems": []
  },
  "discovery": {
    "keywords": [
      "majorization",
      "catalysis",
      "trumping",
      "LOCC"
    ]
  },
  "research": {
    "briefMarkdown": "https://naixu-guo.github.io/quantum-information-open-problems/packets/krueger-2005-catalytic-majorization.md",
    "submitResult": "https://github.com/Naixu-Guo/quantum-information-open-problems/issues/new?template=research-update.yml&title=%5BResearch+update%5D+Catalytic+majorization",
    "contributionSchema": "https://naixu-guo.github.io/quantum-information-open-problems/api/v1/contribution.schema.json"
  },
  "links": {
    "self": "https://naixu-guo.github.io/quantum-information-open-problems/api/v1/problems/krueger-2005-catalytic-majorization.json",
    "human": "https://naixu-guo.github.io/quantum-information-open-problems/problems/krueger-2005-catalytic-majorization/",
    "explorer": "https://naixu-guo.github.io/quantum-information-open-problems/#krueger-2005-catalytic-majorization",
    "markdown": "https://naixu-guo.github.io/quantum-information-open-problems/packets/krueger-2005-catalytic-majorization.md",
    "schema": "https://naixu-guo.github.io/quantum-information-open-problems/api/v1/problem.schema.json",
    "api": "https://naixu-guo.github.io/quantum-information-open-problems/api/v1/problems/krueger-2005-catalytic-majorization.json",
    "sourceRecord": "https://github.com/Naixu-Guo/quantum-information-open-problems/blob/main/open_prob/krueger-2005-catalytic-majorization/problem.md"
  },
  "revision": {
    "algorithm": "sha256",
    "projection": "content-v1",
    "recordDigest": "11aa6a73b042cb59546f4dbd740cc9f8f1bb526227937484666e3cae34387dc5",
    "statementDigest": "d2f7b36daa9d93cd1a8acfdb487f976e10c8be0dabcb1af63ce29ff2f995a4da"
  }
}
